# name: test/sql/dp_sample_median.test
# description: Sample-median helpers and bounded automatic dp_sass rewriting
# group: [sql]

require privacy

statement ok
PRAGMA clear_privacy_metadata;

statement ok
SET threads = 1;

statement ok
SET privacy_seed = 42;

statement ok
SET privacy_mode = 'dp_sass';

statement ok
SET privacy_noise = false;

statement ok
SET dp_epsilon = 1.0;

statement ok
SET dp_delta = 1e-6;

query I
SELECT current_setting('privacy_mode');
----
dp_sass

query I
SELECT current_setting('dp_sample_lanes');
----
1

# The fixed 64-lane and variable-m JList paths match the exact NRS envelope values.
query III
SELECT (abs(dp_smooth_median_noise_scale(
                  list_transform(range(0, 64), lambda i: ((i * i + 7 * i) % 97)::FLOAT),
                  1.0, 1e-6, 1, 0.0, 100.0, 50.0) - 41.82490982255579) < 1e-12)::INTEGER,
       (abs(dp_smooth_median_noise_scale(
                  list_transform(range(0, 128), lambda i: ((i * i + 7 * i) % 97)::FLOAT),
                  1.0, 1e-6, 1, 0.0, 100.0, 50.0) - 22.822139925530006) < 1e-12)::INTEGER,
       (abs(dp_smooth_median_noise_scale(
                  list_transform(range(0, 512), lambda i: ((i * i + 7 * i) % 97)::FLOAT),
                  1.0, 1e-6, 1, 0.0, 100.0, 50.0) - 8.213857364744555) < 1e-12)::INTEGER;
----
1	1	1

statement error
SET dp_sample_lanes = 0;
----
dp_sample_lanes

statement error
SET dp_sample_lanes = 9;
----
dp_sample_lanes

statement ok
SET dp_sample_lanes = 1;

query II
SELECT as_sample_sum(0::UBIGINT, 1.0)[1]::INTEGER,
       as_sample_sum(0::UBIGINT, 1.0)[2]::INTEGER;
----
64	0

query II
SELECT as_sample_avg(0::UBIGINT, 10.0, 2.0)[1]::INTEGER,
       as_sample_avg(0::UBIGINT, 10.0, 2.0)[2] IS NULL;
----
5	true

query I
SELECT abs(as_sample_avg(0::UBIGINT, sum_v, cnt_v)[1] - 7.5) < 1e-5
FROM (VALUES (10.0, 2.0), (20.0, 2.0)) t(sum_v, cnt_v);
----
true

query II
SELECT as_sample_min(0::UBIGINT, 7.0::DOUBLE)[1]::INTEGER,
       as_sample_min(0::UBIGINT, 7.0::DOUBLE)[2] IS NULL;
----
7	true

query II
SELECT as_sample_max(0::UBIGINT, 7.0::DOUBLE)[1]::INTEGER,
       as_sample_max(0::UBIGINT, 7.0::DOUBLE)[2] IS NULL;
----
7	true

query II
SELECT abs(as_sample_min(0::UBIGINT, 7.25::DECIMAL(10,2))[1] - 7.25) < 1e-5,
       as_sample_min(0::UBIGINT, 7.25::DECIMAL(10,2))[2] IS NULL;
----
true	true

query II
SELECT as_sample_min(0::UBIGINT, 0.0::DOUBLE)[1] = 0.0,
       as_sample_min(0::UBIGINT, 0.0::DOUBLE)[2] IS NULL;
----
true	true

statement ok
SET dp_sample_lanes = 2;

query III
SELECT abs(as_sample_sum(64::UBIGINT, 1.0)[1] - (4096.0 / 127.0)) < 1e-5,
       abs(as_sample_sum(64::UBIGINT, 1.0)[2] - (4096.0 / 127.0)) < 1e-5,
       as_sample_sum(64::UBIGINT, 1.0)[3] = 0;
----
true	true	true

statement ok
SET dp_sample_lanes = 8;

# Smooth sensitivity treats affected as a sample-aggregate step size. One PU can
# affect dp_sample_lanes sample lanes, so an eight-lane median jump must be charged
# at distance 0 here, not exponentially decayed as eight separate PU changes. The
# scalar takes sample_lanes explicitly so prepared statements and reused counters
# do not observe a later setting change.
statement ok
SET privacy_noise = true;

statement ok
SET dp_sample_lanes = 1;

query I
WITH vals AS (
    SELECT CASE WHEN i < 39 THEN 0.0::FLOAT ELSE 100000.0::FLOAT END AS v
    FROM range(64) t(i)
), counters AS (
    SELECT list(v ORDER BY v) AS l FROM vals
)
SELECT abs(dp_smooth_median_noise(l, 10.0, 1e-6, 8)) > 10000.0
FROM counters;
----
true

statement ok
SET privacy_noise = false;

query I
WITH vals AS (
    SELECT CASE WHEN i < 31 THEN 0.0::FLOAT ELSE 100000.0::FLOAT END AS v
    FROM range(64) t(i)
), counters AS (
    SELECT list(v ORDER BY v) AS l FROM vals
)
SELECT dp_smooth_median_noise(l, 1.0, 1e-6, 1, -10.0, 10.0) = 10.0
FROM counters;
----
true

# SASS lanes are rescaled to full-output estimators before the terminal release clamps
# them to [lower, upper]. With sample_lanes=1, the lane median for 130 keys is 128,
# so a raw per-lane bound like ceil(130/64)=3 clips the release to 3.
query I
WITH counters AS (
    SELECT as_sample_count(i::UBIGINT) AS l
    FROM range(130) t(i)
)
SELECT dp_smooth_median_noise(l, 1.0, 1e-6, 1, 0.0, 3.0, 0.0)::INTEGER
FROM counters;
----
3

query I
WITH counters AS (
    SELECT as_sample_count(i::UBIGINT) AS l
    FROM range(130) t(i)
)
SELECT dp_smooth_median_noise(l, 1.0, 1e-6, 1, 0.0, 130.0, 0.0)::INTEGER
FROM counters;
----
128

statement ok
SET privacy_noise = false;

query I
WITH vals AS (
    SELECT CASE WHEN i < 33 THEN NULL::FLOAT ELSE 0.0::FLOAT END AS v, i
    FROM range(64) t(i)
), counters AS (
    SELECT list(v ORDER BY i) AS l FROM vals
)
SELECT dp_smooth_median_noise(l, 1.0, 1e-6, 1) IS NULL
FROM counters;
----
true

statement ok
PRAGMA clear_privacy_metadata;

statement ok
CREATE TABLE sass_fast_count_events(uid INTEGER, g INTEGER);

statement ok
INSERT INTO sass_fast_count_events VALUES (1, 0), (1, 1), (2, 0), (3, 1), (3, 1);

statement ok
ALTER TABLE sass_fast_count_events ADD PRIVACY_KEY (uid);

statement ok
ALTER TABLE sass_fast_count_events SET PU;

statement ok
SET dp_sample_lanes = 1;

statement ok
SET dp_count_bound = 10;

statement ok
SET dp_max_groups_contributed = 1;

statement ok
SET dp_sass_count_output_bound = NULL;

statement ok
SET dp_sass_fast_count_star = false;

statement error
SELECT COUNT(*) FROM sass_fast_count_events;
----
dp_sass_count_output_bound

statement ok
SET dp_sass_fast_count_star = true;

statement ok
SET privacy_noise = true;

query I nosort explain_sass_fast_count_star
EXPLAIN SELECT COUNT(*) FROM sass_fast_count_events;
----
dp_noise

statement ok
SET privacy_noise = false;

query I
SELECT COUNT(*) FROM sass_fast_count_events;
----
5

statement error
SELECT COUNT(*) FILTER (WHERE g = 1) FROM sass_fast_count_events;
----
dp_sass_count_output_bound

statement ok
SET dp_sass_fast_count_star = false;

statement ok
SET dp_sass_count_output_bound = 1000;

statement ok
PRAGMA clear_privacy_metadata;

statement ok
CREATE TABLE _sass_part (
    p_partkey INTEGER,
    p_brand VARCHAR,
    p_type VARCHAR,
    p_size INTEGER
);

statement ok
CREATE TABLE _sass_partsupp (
    ps_partkey INTEGER,
    ps_suppkey INTEGER
);

statement ok
CREATE TABLE _sass_supplier (
    s_suppkey INTEGER,
    s_comment VARCHAR
);

statement ok
INSERT INTO _sass_part
SELECT i, 'Brand#11', 'SMALL BRUSHED TIN', 49
FROM range(64) t(i);

statement ok
INSERT INTO _sass_partsupp
SELECT i, i
FROM range(64) t(i);

statement ok
INSERT INTO _sass_supplier
SELECT i, 'ok'
FROM range(64) t(i);

statement ok
INSERT INTO _sass_part
SELECT i + 1000, 'Brand#22', 'SMALL BRUSHED TIN', 49
FROM range(64) t(i);

statement ok
INSERT INTO _sass_partsupp
SELECT i + 1000, 777
FROM range(64) t(i);

statement ok
ALTER TABLE _sass_part ADD PRIVACY_KEY (p_partkey);

statement ok
ALTER TABLE _sass_part SET PU;

statement ok
ALTER PU TABLE _sass_part ADD PROTECTED (p_partkey);

statement ok
ALTER TABLE _sass_supplier ADD PRIVACY_KEY (s_suppkey);

statement ok
ALTER TABLE _sass_partsupp ADD PRIVACY_LINK (ps_partkey) REFERENCES _sass_part(p_partkey);

statement ok
SET privacy_mode = 'dp_sass';

statement ok
SET privacy_noise = false;

statement ok
SET dp_sample_lanes = 8;

statement ok
SET dp_count_bound = 1000;

statement ok
SET dp_max_groups_contributed = 1;

statement ok
SET dp_sass_count_output_bound = 1000;

query I nosort explain_sass_distinct_count
EXPLAIN SELECT p_brand, p_type, p_size, COUNT(DISTINCT ps_suppkey) AS supplier_cnt
FROM _sass_partsupp JOIN _sass_part ON p_partkey = ps_partkey
GROUP BY p_brand, p_type, p_size;
----
as_sample_count_mask

query II rowsort
SELECT p_brand, supplier_cnt
FROM (
    SELECT p_brand, p_type, p_size, COUNT(DISTINCT ps_suppkey) AS supplier_cnt
    FROM _sass_partsupp JOIN _sass_part ON p_partkey = ps_partkey
    GROUP BY p_brand, p_type, p_size
) q
WHERE supplier_cnt > 0;
----
Brand#11	7
Brand#22	1

query I
SELECT supplier_cnt
FROM (
    SELECT p_brand, p_type, p_size, COUNT(DISTINCT ps_suppkey) AS supplier_cnt
    FROM _sass_partsupp JOIN _sass_part ON p_partkey = ps_partkey
    GROUP BY p_brand, p_type, p_size
) q
WHERE p_brand = 'Brand#22';
----
1

statement ok
SET dp_delta = 1e-6;

# COUNT(DISTINCT) grouped queries auto-apply DP partition selection with a computed τ. At ε = 1 the
# threshold τ (~29) sits below each group's distinct-PU support, so both groups survive
# (noise off → deterministic support ≥ τ).
query II rowsort
SELECT p_brand, supplier_cnt
FROM (
    SELECT p_brand, p_type, p_size, COUNT(DISTINCT ps_suppkey) AS supplier_cnt
    FROM _sass_partsupp JOIN _sass_part ON p_partkey = ps_partkey
    GROUP BY p_brand, p_type, p_size
) q;
----
Brand#11	7
Brand#22	1

# An admin-set privacy_min_group_count raises the same noised support gate. Here a threshold far
# above the test data's group support suppresses both groups.
statement ok
SET privacy_min_group_count = 1000000;

query II rowsort
SELECT p_brand, supplier_cnt
FROM (
    SELECT p_brand, p_type, p_size, COUNT(DISTINCT ps_suppkey) AS supplier_cnt
    FROM _sass_partsupp JOIN _sass_part ON p_partkey = ps_partkey
    GROUP BY p_brand, p_type, p_size
) q;
----

statement ok
SET privacy_min_group_count = NULL;

# With a tiny ε the computed τ far exceeds every group's distinct-PU support, so partition
# selection suppresses all groups.
statement ok
SET dp_epsilon = 0.001;

query II rowsort
SELECT p_brand, supplier_cnt
FROM (
    SELECT p_brand, p_type, p_size, COUNT(DISTINCT ps_suppkey) AS supplier_cnt
    FROM _sass_partsupp JOIN _sass_part ON p_partkey = ps_partkey
    GROUP BY p_brand, p_type, p_size
) q;
----

statement ok
SET dp_epsilon = 1.0;

statement error
SELECT COUNT(*)
FROM _sass_partsupp JOIN _sass_part ON p_partkey = ps_partkey
WHERE ps_suppkey NOT IN (
    SELECT s_suppkey
    FROM _sass_supplier
    WHERE s_comment LIKE '%Customer%Complaints%'
);
----
dp_sass: scalar or mark subqueries are not supported by DP mechanisms

# Mixed COUNT(DISTINCT) aggregate lists use the same bounded per-PU distinct-count semantics as
# dp_standard: lower aggregation computes COUNT(DISTINCT x) per (PU, group), clips it by
# dp_count_bound, then releases the SASS sample sum.
query I nosort explain_sass_mixed_distinct_count
EXPLAIN SELECT p_brand, COUNT(DISTINCT ps_suppkey), COUNT(*)
FROM _sass_partsupp JOIN _sass_part ON p_partkey = ps_partkey
GROUP BY p_brand;
----
as_sample_sum

query III rowsort
SELECT p_brand, COUNT(DISTINCT ps_suppkey) AS supplier_cnt, COUNT(*) AS row_cnt
FROM _sass_partsupp JOIN _sass_part ON p_partkey = ps_partkey
GROUP BY p_brand;
----
Brand#11	59	59
Brand#22	59	59

statement ok
SET dp_count_bound = NULL;

statement ok
PRAGMA clear_privacy_metadata;

statement ok
CREATE TABLE _sass_q13_customer (
    c_custkey INTEGER
);

statement ok
CREATE TABLE _sass_q13_orders (
    o_orderkey INTEGER,
    o_custkey INTEGER,
    o_comment VARCHAR
);

statement ok
INSERT INTO _sass_q13_customer
SELECT i::INTEGER
FROM range(64) t(i);

statement ok
INSERT INTO _sass_q13_orders
SELECT i::INTEGER, i::INTEGER, 'ok'
FROM range(64) t(i);

statement ok
ALTER TABLE _sass_q13_customer ADD PRIVACY_KEY (c_custkey);

statement ok
ALTER TABLE _sass_q13_customer SET PU;

statement ok
ALTER TABLE _sass_q13_orders ADD PRIVACY_LINK (o_custkey) REFERENCES _sass_q13_customer(c_custkey);

statement ok
SET dp_count_bound = 1000;

statement ok
SET dp_max_groups_contributed = 1;

statement ok
SET dp_sass_count_output_bound = 1000;

# Nested aggregates are not supported in DP modes. A query may have multiple
# aggregate expressions in one aggregate node, but not aggregate over another
# aggregate's private output.
statement error
EXPLAIN SELECT c_count, COUNT(*) AS custdist
FROM (
    SELECT c_custkey, COUNT(o_orderkey) AS c_count
    FROM _sass_q13_customer
    LEFT OUTER JOIN _sass_q13_orders
      ON c_custkey = o_custkey
     AND o_comment NOT LIKE '%special%requests%'
    GROUP BY c_custkey
) AS c_orders
GROUP BY c_count;
----
dp_sass: expected exactly one aggregate

statement error
SELECT custdist > 0
FROM (
    SELECT c_count, COUNT(*) AS custdist
    FROM (
        SELECT c_custkey, COUNT(o_orderkey) AS c_count
        FROM _sass_q13_customer
        LEFT OUTER JOIN _sass_q13_orders
          ON c_custkey = o_custkey
         AND o_comment NOT LIKE '%special%requests%'
        GROUP BY c_custkey
    ) AS c_orders
    GROUP BY c_count
) q;
----
dp_sass: expected exactly one aggregate

statement ok
PRAGMA clear_privacy_metadata;

statement ok
CREATE TABLE _sass_q21_customer (
    c_custkey INTEGER
);

statement ok
CREATE TABLE _sass_q21_orders (
    o_orderkey INTEGER,
    o_custkey INTEGER,
    o_orderstatus VARCHAR
);

statement ok
CREATE TABLE _sass_q21_lineitem (
    l_orderkey INTEGER,
    l_suppkey INTEGER,
    l_commitdate DATE,
    l_receiptdate DATE
);

statement ok
CREATE TABLE _sass_q21_supplier (
    s_suppkey INTEGER,
    s_nationkey INTEGER,
    s_name VARCHAR
);

statement ok
CREATE TABLE _sass_q21_nation (
    n_nationkey INTEGER,
    n_name VARCHAR
);

statement ok
INSERT INTO _sass_q21_customer
SELECT i::INTEGER
FROM range(64) t(i);

statement ok
INSERT INTO _sass_q21_orders
SELECT i::INTEGER, i::INTEGER, 'F'
FROM range(64) t(i);

statement ok
INSERT INTO _sass_q21_lineitem
SELECT i::INTEGER, 1, DATE '2020-01-01', DATE '2020-01-02'
FROM range(64) t(i);

statement ok
INSERT INTO _sass_q21_lineitem
SELECT i::INTEGER, 2, DATE '2020-01-01', DATE '2020-01-01'
FROM range(64) t(i);

statement ok
INSERT INTO _sass_q21_supplier VALUES
    (1, 1, 'Supplier#1'),
    (2, 1, 'Supplier#2');

statement ok
INSERT INTO _sass_q21_nation VALUES (1, 'SAUDI ARABIA');

statement ok
ALTER TABLE _sass_q21_customer ADD PRIVACY_KEY (c_custkey);

statement ok
ALTER TABLE _sass_q21_customer SET PU;

statement ok
ALTER TABLE _sass_q21_orders ADD PRIVACY_LINK (o_custkey) REFERENCES _sass_q21_customer(c_custkey);

statement ok
ALTER TABLE _sass_q21_lineitem ADD PRIVACY_LINK (l_orderkey) REFERENCES _sass_q21_orders(o_orderkey);

statement ok
ALTER TABLE _sass_q21_supplier ADD PRIVACY_KEY (s_suppkey);

statement ok
ALTER TABLE _sass_q21_nation ADD PRIVACY_KEY (n_nationkey);

statement ok
SET dp_count_bound = 1000;

statement ok
SET dp_max_groups_contributed = 1;

statement ok
SET dp_sass_count_output_bound = 1000;

statement error
EXPLAIN SELECT l1.l_suppkey, COUNT(*) AS numwait
FROM _sass_q21_lineitem l1, _sass_q21_orders
WHERE o_orderkey = l1.l_orderkey
  AND o_orderstatus = 'F'
  AND l1.l_receiptdate > l1.l_commitdate
  AND EXISTS (
    SELECT *
    FROM _sass_q21_lineitem l2
    WHERE l2.l_orderkey = l1.l_orderkey
      AND l2.l_suppkey <> l1.l_suppkey
  )
  AND NOT EXISTS (
    SELECT *
    FROM _sass_q21_lineitem l3
    WHERE l3.l_orderkey = l1.l_orderkey
      AND l3.l_suppkey <> l1.l_suppkey
      AND l3.l_receiptdate > l3.l_commitdate
  )
GROUP BY l1.l_suppkey;
----
dp_sass: lateral or correlated subqueries are not supported by DP mechanisms

statement error
SELECT numwait > 0
FROM (
    SELECT l1.l_suppkey, COUNT(*) AS numwait
    FROM _sass_q21_lineitem l1, _sass_q21_orders
    WHERE o_orderkey = l1.l_orderkey
      AND o_orderstatus = 'F'
      AND l1.l_receiptdate > l1.l_commitdate
      AND EXISTS (
        SELECT *
        FROM _sass_q21_lineitem l2
        WHERE l2.l_orderkey = l1.l_orderkey
          AND l2.l_suppkey <> l1.l_suppkey
      )
      AND NOT EXISTS (
        SELECT *
        FROM _sass_q21_lineitem l3
        WHERE l3.l_orderkey = l1.l_orderkey
          AND l3.l_suppkey <> l1.l_suppkey
          AND l3.l_receiptdate > l3.l_commitdate
      )
    GROUP BY l1.l_suppkey
) q;
----
dp_sass: lateral or correlated subqueries are not supported by DP mechanisms

statement error
SELECT COUNT(*)
FROM _sass_q21_lineitem a
JOIN _sass_q21_lineitem b
  ON a.l_orderkey = b.l_orderkey;
----
self-joins are only supported

statement ok
SET dp_count_bound = NULL;

query I
WITH vals AS (
    SELECT CASE WHEN i < 32 THEN NULL::FLOAT ELSE 0.0::FLOAT END AS v, i
    FROM range(64) t(i)
), counters AS (
    SELECT list(v ORDER BY i) AS l FROM vals
)
SELECT dp_smooth_median_noise(l, 1.0, 1e-6, 1) = 0.0
FROM counters;
----
true

query I
WITH vals AS (
    SELECT CASE WHEN i < 32 THEN NULL::FLOAT WHEN i < 48 THEN -10.0::FLOAT ELSE 10.0::FLOAT END AS v, i
    FROM range(64) t(i)
), counters AS (
    SELECT list(v ORDER BY i) AS l FROM vals
)
SELECT dp_smooth_median_noise(l, 1.0, 1e-6, 1) = 10.0
FROM counters;
----
true

statement ok
CREATE PU TABLE sass_users(uid INTEGER, v DOUBLE, PRIVACY_KEY(uid));

statement ok
INSERT INTO sass_users VALUES (1, 10.0), (2, 20.0), (3, 1000.0);

# Automatic dp_sass requires explicit sample-output domain bounds.
statement error
SELECT COUNT(*) FROM sass_users;
----
dp_count_bound

statement error
SELECT SUM(v) FROM sass_users;
----
dp_sum_bound

statement ok
SET dp_sum_bound = 500.0;

statement ok
SET dp_sass_avg_lower_bound = 0.0;

statement ok
SET dp_sass_avg_upper_bound = 500.0;

statement ok
SET dp_count_bound = NULL;

statement error
SELECT AVG(v) FROM sass_users;
----
dp_count_bound

statement ok
SET dp_count_bound = -1.0;

statement error
SELECT COUNT(*) FROM sass_users;
----
dp_count_bound

statement ok
SET dp_count_bound = 10.0;

statement ok
SET dp_sass_count_output_bound = 10.0;

query I
SELECT COUNT(*) IS NOT NULL FROM sass_users;
----
true

statement ok
SET dp_sass_sum_output_bound = 500.0;

query I
SELECT SUM(v) IS NOT NULL FROM sass_users;
----
true

# Multiple aggregate expressions in the same aggregate node are supported.
query II
SELECT COUNT(*) IS NOT NULL, SUM(v) IS NOT NULL FROM sass_users;
----
true	true

statement ok
SET dp_sass_avg_lower_bound = 0.0;

statement ok
SET dp_sass_avg_upper_bound = 500.0;

# AVG no longer returns a data-dependent NULL on sparse input. Empty subsample lanes are filled
# with the public midpoint of [dp_sass_avg_lower_bound, dp_sass_avg_upper_bound], so the populated-
# lane count is data-independent and the release is always a (noised) value. Previously a table with
# fewer than 32 populated lanes leaked group support by flipping the output to NULL.
query I
SELECT AVG(v) IS NOT NULL FROM sass_users;
----
true

# --- AVG estimator flag (dp_sass_avg_method) ---
# 'lane_average' (default): median/mean of the 64 per-lane averages (NRS/GUPT sample-and-aggregate of
# the mean). 'nonempty_lane_average': noisy shifted SUM of populated-lane averages divided by their
# noisy count. 'ratio': two independent SAA mechanisms for the original row SUM and COUNT. All three
# satisfy DP; the flag lets us compare utility.
statement ok
CREATE PU TABLE sass_avg_flag(uid INTEGER, v DOUBLE, PRIVACY_KEY(uid));

statement ok
INSERT INTO sass_avg_flag SELECT i, (i % 10) * 1.0 FROM range(200) t(i);

statement ok
SET dp_sass_release = 'average';

statement ok
SET dp_sum_bound = 100.0;

statement ok
SET dp_count_bound = 1.0;

statement ok
SET dp_sass_sum_output_bound = 100000.0;

statement ok
SET dp_sass_count_output_bound = 100000.0;

statement ok
SET dp_sass_avg_lower_bound = 0.0;

statement ok
SET dp_sass_avg_upper_bound = 10.0;

# ratio: noise off + generous output bounds → noised_sum / noised_count = 900 / 200 = 4.5 exactly.
statement ok
SET dp_sass_avg_method = 'ratio';

query I
SELECT AVG(v) FROM sass_avg_flag;
----
4.5

# ratio clamps the released mean into the public avg domain [lower, upper] (free post-processing):
# a tight upper bound of 3.0 clamps the 4.5 mean down to 3.0.
statement ok
SET dp_sass_avg_upper_bound = 3.0;

query I
SELECT AVG(v) FROM sass_avg_flag;
----
3.0

statement ok
SET dp_sass_avg_upper_bound = 10.0;

# ratio still validates the avg domain (inverted range rejected, even though the ratio derives from
# the sum/count output bounds).
statement ok
SET dp_sass_avg_lower_bound = 500.0;

statement error
SELECT AVG(v) FROM sass_avg_flag;
----
dp_sass_avg_lower_bound must be smaller than

statement ok
SET dp_sass_avg_lower_bound = 0.0;

# Generic public AVG domains can be provided per AVG expression. SASS uses them as
# output domains for the sample mean; standard DP uses the same public domains for
# bounded mean centering. This matters when one query mixes AVG columns with very
# different scales.
statement ok
CREATE PU TABLE sass_avg_bounds(uid INTEGER, v DOUBLE, PRIVACY_KEY(uid));

statement ok
INSERT INTO sass_avg_bounds SELECT i, 1.0 FROM range(4096) t(i);

statement ok
SET dp_sum_bound = 1000.0;

statement ok
SET dp_avg_lower_bounds = '0,0';

statement ok
SET dp_avg_upper_bounds = '3,1000';

statement ok
SET dp_sass_avg_method = 'lane_average';

query II
SELECT AVG(4.5) = 3.0, abs(AVG(450.0) - 450.0) < 0.001 FROM sass_avg_bounds;
----
true	true

statement ok
SET privacy_mode = 'dp_standard';

statement ok
SET dp_avg_upper_bounds = '10,1000';

query II
SELECT abs(AVG(4.5) - 4.5) < 0.001, abs(AVG(450.0) - 450.0) < 0.001 FROM sass_avg_bounds;
----
true	true

statement ok
SET privacy_mode = 'dp_sass';

statement ok
SET dp_avg_lower_bounds = NULL;

statement ok
SET dp_avg_upper_bounds = NULL;

# lane_average (default): median/mean of the per-lane averages, close to the true mean 4.5.
statement ok
SET dp_sass_avg_method = 'lane_average';

query I
SELECT abs(AVG(v) - 4.5) < 1.0 FROM sass_avg_flag;
----
true

# Invalid estimator is rejected at query time.
statement ok
SET dp_sass_avg_method = 'bogus';

statement error
SELECT AVG(v) FROM sass_avg_flag;
----
must be 'lane_average', 'nonempty_lane_average', or 'ratio'

# Non-empty-lane AVG removes fixed-fill bias by privately releasing the shifted SUM of populated
# lane averages and their populated-lane count. With noise disabled, sparse and NULL-heavy inputs
# therefore retain their ordinary AVG rather than drifting toward the public-domain midpoint.
statement ok
CREATE PU TABLE sass_sparse_lane_avg(uid INTEGER, v DOUBLE, PRIVACY_KEY(uid));

statement ok
INSERT INTO sass_sparse_lane_avg SELECT i, 100.0 FROM range(8) t(i);

statement ok
SET dp_sum_bound = 1000.0;

statement ok
SET dp_sass_avg_lower_bound = 0.0;

statement ok
SET dp_sass_avg_upper_bound = 1000.0;

statement ok
SET dp_sass_avg_method = 'nonempty_lane_average';

query I nosort explain_nonempty_lane_avg
EXPLAIN SELECT AVG(v) FROM sass_sparse_lane_avg;
----
dp_nonempty_mean_noise

query I
SELECT AVG(v) FROM sass_sparse_lane_avg;
----
100

# Each released aggregate cell receives independent numerator/count noise. Separate list vectors
# start at the same child offset, so this catches accidental nonce reuse across AVG expressions.
statement ok
CREATE PU TABLE sass_multi_lane_avg_users(uid INTEGER, PRIVACY_KEY(uid));

statement ok
CREATE TABLE sass_multi_lane_avg(uid INTEGER, g INTEGER, a DOUBLE, b DOUBLE);

statement ok
INSERT INTO sass_multi_lane_avg_users SELECT i FROM range(8) t(i);

statement ok
INSERT INTO sass_multi_lane_avg SELECT i, i % 2, 100.0, 100.0 FROM range(8) t(i);

statement ok
ALTER TABLE sass_multi_lane_avg ADD PRIVACY_LINK (uid) REFERENCES sass_multi_lane_avg_users(uid);

statement ok
SET dp_epsilon = 100.0;

statement ok
SET privacy_noise = true;

query I
SELECT AVG(a) <> AVG(b) FROM sass_multi_lane_avg;
----
true

statement ok
SET dp_max_groups_contributed = 1;

query II rowsort
SELECT g, AVG(a) <> AVG(b) FROM sass_multi_lane_avg GROUP BY g;
----
0	true
1	true

statement ok
SET privacy_noise = false;

statement ok
SET dp_epsilon = 1.0;

statement ok
INSERT INTO sass_sparse_lane_avg SELECT i, NULL FROM range(8, 12) t(i);

query I
SELECT AVG(v) FROM sass_sparse_lane_avg;
----
100

# Shifting by the public lower bound keeps the numerator sensitivity at U-L even when a populated
# lane disappears. This also preserves means whose public domain does not contain zero.
statement ok
SET dp_sample_lanes = 1;

statement ok
CREATE PU TABLE sass_positive_lane_avg(uid INTEGER, v DOUBLE, PRIVACY_KEY(uid));

statement ok
INSERT INTO sass_positive_lane_avg SELECT i, 39000.0 FROM range(4) t(i);

statement ok
SET dp_sum_bound = 40000.0;

statement ok
SET dp_sass_avg_lower_bound = 38000.0;

statement ok
SET dp_sass_avg_upper_bound = 40000.0;

query I
SELECT AVG(v) FROM sass_positive_lane_avg;
----
39000

# The same terminal handles the variable-m list representation.
statement ok
SET dp_sass_m = 128;

query I
SELECT AVG(v) FROM sass_positive_lane_avg;
----
39000

statement ok
SET dp_sass_m = 64;

# The cell epsilon is split equally: with epsilon=1 and [38000,40000], numerator scale is 4000 and
# populated-lane-count scale is 2. The legacy scalar noise_scale is NULL because this is a ratio.
query III
SELECT numerator_noise_scale::INTEGER, denominator_noise_scale::INTEGER, valid_lane_count
FROM dp_sass_noise_scale_query('SELECT AVG(v) FROM sass_positive_lane_avg');
----
4000	2	4

# With no populated lanes and noise disabled, max(1, noisy_count) makes the shifted ratio well-defined.
statement ok
CREATE PU TABLE sass_empty_lane_avg(uid INTEGER, v DOUBLE, PRIVACY_KEY(uid));

statement ok
INSERT INTO sass_empty_lane_avg SELECT i, NULL FROM range(4) t(i);

query I
SELECT AVG(v) FROM sass_empty_lane_avg;
----
38000

# This estimator is a pure-epsilon average release, not a smooth-median release.
statement ok
SET dp_sass_release = 'median';

statement error
SELECT AVG(v) FROM sass_sparse_lane_avg;
----
requires dp_sass_release='average'

statement ok
SET dp_sass_release = 'average';

statement ok
SET dp_sass_avg_method = 'lane_average';

# --- SUM estimator flag (dp_sass_sum_method) ---
# The opt-in non-empty estimator preserves lane occupancy, privately releases the SUM and populated-lane
# COUNT, and calibrates numerator noise to the enforced per-PU SUM bound. The fixed-lane estimator remains
# the default. With one unscaled populated lane, their non-private targets are respectively 10 and 10/64.
statement ok
CREATE PU TABLE sass_sparse_lane_sum(uid INTEGER, v DOUBLE, PRIVACY_KEY(uid));

statement ok
INSERT INTO sass_sparse_lane_sum VALUES (1, 10.0);

statement ok
SET dp_sample_lanes = 1;

statement ok
SET dp_sass_sum_output_bounds = NULL;

statement ok
SET dp_sass_sum_output_lower_bounds = NULL;

statement ok
SET dp_sass_sum_output_upper_bounds = NULL;

statement ok
SET dp_sass_sum_output_bound = 10000.0;

statement ok
SET dp_sum_bound = 100.0;

statement ok
SET dp_sass_rescale = false;

statement ok
SET dp_sass_sum_method = 'lane_average';

query I
SELECT abs(SUM(v) - (10.0 / 64.0)) < 1e-6 FROM sass_sparse_lane_sum;
----
true

statement ok
SET dp_sass_sum_method = 'nonempty_lane_average';

query I nosort explain_nonempty_lane_sum
EXPLAIN SELECT SUM(v) FROM sass_sparse_lane_sum;
----
as_sample_nullable_sum

query I nosort explain_nonempty_lane_sum_terminal
EXPLAIN SELECT SUM(v) FROM sass_sparse_lane_sum;
----
dp_nonempty_mean_noise

query I
SELECT SUM(v)::INTEGER FROM sass_sparse_lane_sum;
----
10

# The cell epsilon is split equally. With C_sum=100 and no rescaling, numerator scale is 200;
# populated-lane-count scale is 2, and a real zero-valued lane would still count as populated.
query III
SELECT numerator_noise_scale::INTEGER, denominator_noise_scale::INTEGER, valid_lane_count
FROM dp_sass_noise_scale_query('SELECT SUM(v) FROM sass_sparse_lane_sum');
----
200	2	1

# Multiple SUM cells use independent numerator/count noise streams.
statement ok
SET dp_epsilon = 100.0;

statement ok
SET privacy_noise = true;

query I
SELECT SUM(a) <> SUM(b) FROM sass_multi_lane_avg;
----
true

statement ok
SET privacy_noise = false;

statement ok
SET dp_epsilon = 1.0;

statement ok
INSERT INTO sass_sparse_lane_sum VALUES (2, 0.0);

statement ok
DELETE FROM sass_sparse_lane_sum WHERE uid = 1;

query I
SELECT valid_lane_count
FROM dp_sass_noise_scale_query('SELECT SUM(v) FROM sass_sparse_lane_sum');
----
1

# Rescaled lane SUMs and their per-PU sensitivity both gain the 64x sampling factor.
statement ok
DELETE FROM sass_sparse_lane_sum;

statement ok
INSERT INTO sass_sparse_lane_sum VALUES (1, 10.0);

statement ok
SET dp_sass_rescale = true;

query I
SELECT SUM(v)::INTEGER FROM sass_sparse_lane_sum;
----
640

query I
SELECT numerator_noise_scale::INTEGER
FROM dp_sass_noise_scale_query('SELECT SUM(v) FROM sass_sparse_lane_sum');
----
12800

# The variable-m path preserves the same occupancy semantics and uses its configured rescaling factor.
statement ok
SET dp_sass_m = 128;

query I nosort explain_nonempty_lane_sum_m
EXPLAIN SELECT SUM(v) FROM sass_sparse_lane_sum;
----
as_sample_m_nullable_sum

query I
SELECT SUM(v)::INTEGER FROM sass_sparse_lane_sum;
----
1280

query III
SELECT numerator_noise_scale::INTEGER, denominator_noise_scale::INTEGER, valid_lane_count
FROM dp_sass_noise_scale_query('SELECT SUM(v) FROM sass_sparse_lane_sum');
----
25600	2	1

statement ok
SET dp_sass_rescale = false;

query I
SELECT SUM(v)::INTEGER FROM sass_sparse_lane_sum;
----
10

statement ok
SET dp_sass_m = 64;

statement ok
SET dp_sass_sum_method = 'bogus';

# SUM-only configuration is ignored by queries that do not contain SUM.
query I
SELECT COUNT(v) IS NOT NULL FROM sass_sparse_lane_sum;
----
true

statement error
SELECT SUM(v) FROM sass_sparse_lane_sum;
----
must be 'lane_average' or 'nonempty_lane_average'

statement ok
SET dp_sass_sum_method = 'nonempty_lane_average';

statement ok
SET dp_sass_release = 'median';

statement error
SELECT SUM(v) FROM sass_sparse_lane_sum;
----
requires dp_sass_release='average'

statement ok
SET dp_sass_sum_method = 'lane_average';

statement ok
SET dp_sass_release = 'average';

statement ok
SET dp_sass_rescale = true;

statement ok
SET dp_sample_lanes = 8;

# Restore the default median release for the subsequent tests.
statement ok
SET dp_sass_release = 'median';

statement ok
CREATE PU TABLE sass_many(uid INTEGER, v DOUBLE, PRIVACY_KEY(uid));

statement ok
INSERT INTO sass_many
SELECT i, i::DOUBLE FROM range(200) t(i);

statement ok
SET dp_count_bound = NULL;

statement ok
SET dp_count_bound = 10.0;

statement ok
SET dp_sum_bound = 500.0;

statement ok
SET dp_sass_count_output_bound = 200.0;

statement ok
SET dp_sass_sum_output_bound = 20000.0;

statement ok
SET dp_sass_avg_lower_bound = 0.0;

statement ok
SET dp_sass_avg_upper_bound = 200.0;

query I nosort explain_sass_avg
EXPLAIN SELECT AVG(v) FROM sass_many;
----
as_sample_avg

statement ok
SET dp_sass_minmax_lower_bound = 0.0;

statement ok
SET dp_sass_minmax_upper_bound = 200.0;

query I nosort explain_sass_min
EXPLAIN SELECT MIN(v) FROM sass_many;
----
as_sample_min

query I nosort explain_sass_max
EXPLAIN SELECT MAX(v) FROM sass_many;
----
as_sample_max

query I
SELECT MIN(v) IS NOT NULL FROM sass_many;
----
true

query I
SELECT MAX(v) IS NOT NULL FROM sass_many;
----
true

statement error
SELECT MIN('x') FROM sass_many;
----
min argument must be a numeric type

query I
SELECT AVG(v) IS NOT NULL FROM sass_many;
----
true

statement ok
CREATE PU TABLE sass_balanced_130(uid INTEGER, PRIVACY_KEY(uid));

statement ok
INSERT INTO sass_balanced_130
SELECT i FROM range(130) t(i);

# With dp_sample_lanes=1, dp_sass assigns every PU to exactly one of the 64
# sample counters. For 130 PUs, 62 counters hold 2 PUs and 2 counters hold 3;
# the noise-free sample median is therefore 2 * 64 = 128 after rescaling.
statement ok
SET dp_sample_lanes = 1;

query I
SELECT COUNT(*) FROM sass_balanced_130;
----
128

statement ok
CREATE PU TABLE sass_balanced_users(uid INTEGER, PRIVACY_KEY(uid));

statement ok
CREATE TABLE sass_balanced_events(uid INTEGER, event_id INTEGER);

statement ok
INSERT INTO sass_balanced_users
SELECT i FROM range(130) t(i);

statement ok
INSERT INTO sass_balanced_events
SELECT i, i FROM range(130) t(i);

statement ok
ALTER TABLE sass_balanced_events ADD PRIVACY_LINK (uid) REFERENCES sass_balanced_users(uid);

query I
SELECT COUNT(*) FROM sass_balanced_events;
----
128

statement ok
CREATE TABLE sass_distinct_pu_opt(uid INTEGER, payload INTEGER);

statement ok
INSERT INTO sass_distinct_pu_opt
SELECT i, i % 7 FROM range(130) t(i)
UNION ALL
SELECT i, 10 + (i % 7) FROM range(130) t(i);

statement ok
ALTER TABLE sass_distinct_pu_opt ADD PRIVACY_KEY (uid);

statement ok
ALTER TABLE sass_distinct_pu_opt SET PU;

query I nosort explain_sass_distinct_pu_fast
EXPLAIN SELECT COUNT(DISTINCT uid) FROM sass_distinct_pu_opt;
----
as_sample_count

query I
SELECT COUNT(DISTINCT uid) FROM sass_distinct_pu_opt;
----
128

query I nosort explain_sass_distinct_non_pu_generic
EXPLAIN SELECT COUNT(DISTINCT payload) FROM sass_distinct_pu_opt;
----
as_sample_count_mask

statement ok
CREATE TABLE sass_sum_offset_opt(uid INTEGER, v INTEGER);

statement ok
INSERT INTO sass_sum_offset_opt
SELECT i, 1 FROM range(130) t(i);

statement ok
ALTER TABLE sass_sum_offset_opt ADD PRIVACY_KEY (uid);

statement ok
ALTER TABLE sass_sum_offset_opt SET PU;

query I nosort explain_sass_sum_offset_generic
EXPLAIN SELECT SUM(v), SUM(v + 1), SUM(1 + v), SUM(v + 2) FROM sass_sum_offset_opt;
----
as_sample_sum

query IIII
SELECT SUM(v), SUM(v + 1), SUM(1 + v), SUM(v + 2) FROM sass_sum_offset_opt;
----
128	256	256	384

statement ok
CREATE TABLE sass_sum_offset_bound_guard(uid INTEGER, v INTEGER);

statement ok
INSERT INTO sass_sum_offset_bound_guard
SELECT i, -1000 FROM range(130) t(i);

statement ok
ALTER TABLE sass_sum_offset_bound_guard ADD PRIVACY_KEY (uid);

statement ok
ALTER TABLE sass_sum_offset_bound_guard SET PU;

statement ok
SET dp_sum_bound = 1.0;

query I
SELECT SUM(v + 1000) FROM sass_sum_offset_bound_guard;
----
0

query II
SELECT SUM(v), SUM(v + 1000) FROM sass_sum_offset_bound_guard;
----
-128	0

statement ok
SET dp_sum_bound = 2.0;

statement ok
CREATE TABLE sass_sum_cast_offset_opt(uid INTEGER, v DOUBLE);

statement ok
INSERT INTO sass_sum_cast_offset_opt
SELECT i, 1.2 FROM range(130) t(i);

statement ok
ALTER TABLE sass_sum_cast_offset_opt ADD PRIVACY_KEY (uid);

statement ok
ALTER TABLE sass_sum_cast_offset_opt SET PU;

query II
SELECT SUM(CAST(v AS INTEGER)), SUM(CAST(v AS INTEGER) + 1) FROM sass_sum_cast_offset_opt;
----
128	256

statement ok
SET dp_sum_bound = 500.0;

# GUPT-style mean release (pure-ε; no delta required).
statement ok
SET dp_sass_release = 'average';

statement ok
SET dp_delta = NULL;

query I nosort explain_gupt_mean
EXPLAIN SELECT COUNT(*) FROM sass_many;
----
dp_gupt_mean_noise

query I
SELECT COUNT(*) IS NOT NULL FROM sass_many;
----
true

statement ok
CREATE PU TABLE sass_group_users(uid INTEGER, PRIVACY_KEY(uid));

statement ok
CREATE TABLE sass_group_events(uid INTEGER, g INTEGER);

statement ok
INSERT INTO sass_group_users
SELECT i FROM range(200) t(i);

statement ok
INSERT INTO sass_group_events
SELECT i, CASE WHEN i < 40 THEN 0 ELSE i END
FROM range(200) t(i);

statement ok
ALTER TABLE sass_group_events ADD PRIVACY_LINK (uid) REFERENCES sass_group_users(uid);

# The pure-ε 'average' release needs no dp_delta — for an UNGROUPED query, which has a single
# data-independent output row and thus no partition selection.
statement ok
SET dp_sass_release = 'average';

statement ok
SET dp_delta = NULL;

query I
SELECT COUNT(*) IS NOT NULL FROM sass_group_events;
----
true

# A GROUPED query always applies DP partition selection (the released key set is data-dependent),
# which needs δ_η. So a grouped query under the pure-ε average release without dp_delta is rejected.
statement error
SELECT g, COUNT(*) FROM sass_group_events GROUP BY g;
----
dp_delta

statement ok
SET dp_delta = 1e-6;

statement ok
SELECT g, SUM(uid) FROM sass_group_events GROUP BY g;

statement ok
SET dp_sass_release = 'median';

statement ok
SET dp_delta = 1e-6;

statement ok
SET privacy_noise = false;

statement ok
SET dp_max_groups_contributed = 1;

# Grouped queries auto-apply DP partition selection (computed τ ≈ 29 at ε = 1); group 0 has 40
# distinct PUs so it survives (noise off → deterministic support ≥ τ), while the 160 singleton
# groups (1 PU each) are suppressed.
query II rowsort
SELECT g, CAST(c IS NOT NULL AS INTEGER)
FROM (
    SELECT g, COUNT(*) AS c
    FROM sass_group_events
    GROUP BY g
);
----
0	1

statement ok
SET privacy_mode = 'dp_standard';

statement ok
SET dp_count_bound = 1000;

statement ok
SET privacy_min_group_count = 41;

query II rowsort
SELECT g, c
FROM (
    SELECT g, COUNT(*) AS c
    FROM sass_group_events
    GROUP BY g
);
----

statement ok
SET privacy_min_group_count = NULL;

statement ok
SET privacy_mode = 'dp_sass';

# τ derives from the Google-DP formula over C_u, ε_η, δ_η (Algorithm 2 SIMD-SAA^udp), so it scales
# with the privacy budget. With a tiny ε the threshold τ far exceeds group 0's 40 distinct PUs, so
# even this dense group is suppressed (noise off → deterministic support ≥ τ).
statement ok
SET dp_epsilon = 0.01;

query II rowsort
SELECT g, c
FROM (
    SELECT g, COUNT(*) AS c
    FROM sass_group_events
    GROUP BY g
);
----

statement ok
SET dp_epsilon = 1.0;

# Smoke test: the exact SmoothSensitivityMedian (Algorithm 1 + JList) bounded path
# with noise ON. The 64 lane values have a large gap just ABOVE the median (off-center),
# which the exact NRS envelope charges even though a centered window could miss it. With a
# fixed seed the released value is deterministic; we only assert it is finite (the path runs
# and produces a sane noised scalar).
statement ok
SET privacy_noise = true;

statement ok
SET privacy_seed = 42;

query I
WITH vals AS (
    SELECT CASE WHEN i < 30 THEN -5.0::FLOAT WHEN i < 34 THEN 0.0::FLOAT ELSE 500.0::FLOAT END AS v, i
    FROM range(64) t(i)
), counters AS (
    SELECT list(v ORDER BY i) AS l FROM vals
)
SELECT isfinite(dp_smooth_median_noise(l, 1.0, 1e-6, 1, -1000.0, 1000.0))
FROM counters;
----
true

# End-to-end dp_sass with noise ON: confirm SUM/COUNT run through the real plan and
# produce finite, non-null noised values via the exact bounded terminal.
query I
SELECT r IS NOT NULL AND isfinite(r::DOUBLE) FROM (SELECT SUM(v) AS r FROM sass_many);
----
true

statement ok
SET dp_count_bound = 10.0;

query I
SELECT r IS NOT NULL AND isfinite(r::DOUBLE) FROM (SELECT COUNT(*) AS r FROM sass_many);
----
true

statement ok
SET privacy_noise = false;

statement ok
SET dp_sample_lanes = 1;

query I
WITH counters AS (
    SELECT as_sample_count((64 + i)::UBIGINT) AS samples
    FROM range(64) t(i)
)
SELECT (dp_sass_stability(samples)).stddev_pop = 0.0
FROM counters;
----
true

query II
WITH counters AS (
    SELECT as_sample_count(0::UBIGINT) AS samples
)
SELECT (dp_sass_stability(samples)).valid_count,
       (dp_sass_stability(samples)).null_count
FROM counters;
----
64	0

query III
WITH counters AS (
    SELECT list(CASE WHEN i < 32 THEN NULL::FLOAT ELSE i::FLOAT END ORDER BY i) AS samples
    FROM range(64) t(i)
)
SELECT (dp_sass_stability(samples)).valid_count,
       (dp_sass_stability(samples)).null_count,
       (dp_sass_stability(samples)).stable_mad_1
FROM counters;
----
32	32	false

# --- Implicit FK path (PU table not named in FROM) — regression for stable sample lanes ---
# Before this fix, dp_sass silently mis-handled a query over a PRIVACY_LINK table that never scans the
# PU table: the stable lane key was unavailable, so SUM/COUNT returned 0 and AVG returned the empty-lane
# midpoint. The lanes are now built from the PU-adjacent linked table's FK column, so a PU's many rows
# share one lane. With a constant value the mean is exact, so the implicit result must equal the
# explicit-join result.
statement ok
SET privacy_mode = 'dp_sass';

statement ok
CREATE PU TABLE ifk_users(uid INTEGER, PRIVACY_KEY(uid));

statement ok
INSERT INTO ifk_users SELECT i FROM range(200) t(i);

statement ok
CREATE TABLE ifk_events(uid INTEGER, v DOUBLE);

statement ok
INSERT INTO ifk_events SELECT i % 200, 8.0 FROM range(2000) t(i);

statement ok
ALTER TABLE ifk_events ADD PRIVACY_LINK (uid) REFERENCES ifk_users(uid);

statement ok
SET privacy_noise = false;

statement ok
SET privacy_seed = 42;

statement ok
SET dp_sass_release = 'median';

statement ok
SET dp_delta = 1e-5;

statement ok
SET dp_sum_bound = 1000.0;

statement ok
SET dp_count_bound = 100.0;

statement ok
SET dp_sass_sum_output_bound = 100000.0;

statement ok
SET dp_sass_count_output_bound = 100000.0;

statement ok
SET dp_sass_avg_lower_bound = 0.0;

statement ok
SET dp_sass_avg_upper_bound = 10.0;

# Not broken: implicit SUM/COUNT/COUNT(DISTINCT) are populated (previously 0 from empty lanes).
query I
SELECT SUM(v) > 0 FROM ifk_events;
----
true

query I
SELECT COUNT(*) > 0 FROM ifk_events;
----
true

# COUNT(DISTINCT) shares the same lane-assignment site — also fixed for the implicit path.
query I
SELECT COUNT(DISTINCT v) > 0 FROM ifk_events;
----
true

# lane_average AVG: constant value → exact mean 8.0, and the implicit result equals the explicit join
# (previously implicit returned the empty-lane midpoint 5.0).
query I
SELECT AVG(v) FROM ifk_events;
----
8.0

query I
SELECT AVG(v) FROM ifk_events JOIN ifk_users ON ifk_events.uid = ifk_users.uid;
----
8.0

# ratio AVG: same, over the implicit FK path (previously 0.0 = noised_sum 0 / noised_count 0).
statement ok
SET dp_sass_avg_method = 'ratio';

query I
SELECT AVG(v) FROM ifk_events;
----
8.0

query I
SELECT AVG(v) FROM ifk_events JOIN ifk_users ON ifk_events.uid = ifk_users.uid;
----
8.0

statement ok
SET dp_sass_avg_method = 'lane_average';

statement ok
SET dp_sass_release = 'median';

statement ok
SET privacy_mode = 'dp_elastic';

# Tiny delta should not make the Wilson partition threshold numerically infinite for dp_sass either.
# Before the stable log1p/expm1 form, (1 - delta_eta) rounded to 1 and suppressed this group.
statement ok
SET privacy_mode = 'dp_sass';

statement ok
SET privacy_noise = false;

statement ok
SET dp_epsilon = 1.0;

statement ok
SET dp_delta = 1e-100;

statement ok
SET dp_count_bound = 1.0;

statement ok
SET dp_max_groups_contributed = 1.0;

statement ok
SET dp_sass_count_output_bound = 100000.0;

statement ok
CREATE TABLE dp_sass_tiny_delta_users AS
SELECT i::INTEGER AS uid
FROM range(600) AS t(i);

statement ok
CREATE TABLE dp_sass_tiny_delta_events AS
SELECT i::INTEGER AS uid, 0::INTEGER AS g
FROM range(600) AS t(i);

statement ok
ALTER TABLE dp_sass_tiny_delta_users ADD PRIVACY_KEY (uid);

statement ok
ALTER TABLE dp_sass_tiny_delta_users SET PU;

statement ok
ALTER TABLE dp_sass_tiny_delta_events ADD PRIVACY_LINK (uid) REFERENCES dp_sass_tiny_delta_users (uid);

query I
SELECT g
FROM (
    SELECT g, COUNT(*) AS c
    FROM dp_sass_tiny_delta_events
    GROUP BY g
)
ORDER BY g;
----
0

statement ok
SET privacy_noise = true;
